{"belgi_version":"0.2.0","evidence_manifest_ref":{"hash":"64b3419d5466bb20c82c6619af947c0e36c2753e8fb9a48d8d0702262cc8f1c0","id":"evidence-manifest-run-seal-fixture-001","storage_ref":"policy/fixtures/public/seal/s_pass_tier2_commit_sha_changed/EvidenceManifest.json"},"final_commit_sha":"ffffffffffffffffffffffffffffffffffffffff","gate_q_verdict_ref":{"hash":"e06e844159a63dde305a77826edc62a88ae6d0455b961b03bd964d3a116db382","id":"gate-Q-run-seal-fixture-001","storage_ref":"policy/fixtures/public/seal/s_pass_tier2_commit_sha_changed/GateVerdict.Q.json"},"gate_r_verdict_ref":{"hash":"ff3304e25150a4c1461f7240d12667b8f82d7ddb363eba5f0229ec058f668fc8","id":"gate-R-run-seal-fixture-001","storage_ref":"policy/fixtures/public/seal/s_pass_tier2_commit_sha_changed/GateVerdict.R.json"},"locked_spec_ref":{"hash":"939957c9131a765b8254223d39abfad18633a8ce96634cf5c3f509492f63adcd","id":"lockedspec-run-seal-fixture-001","storage_ref":"policy/fixtures/public/seal/s_pass_tier2_commit_sha_changed/LockedSpec.json"},"run_id":"run-seal-fixture-001","schema_version":"1.0.0","seal_hash":"c807a70092f7bc3c5ebc8773c7eed41f0270704f2f80e1b72265dfd49bc73a0f","sealed_at":"2000-01-01T00:30:00Z","signature":"AmtS0Z9OBGLfR8cCxygfcGTYm3JHfxJediGrO9vQzHPNFlacybBbOIZXrRTbxj+Ean6egMRihYw3lQAUFlylDg==","signature_alg":"ed25519","signer":"human:fixture","waivers":[]}
