{"belgi_version":"0.2.0","evidence_manifest_ref":{"hash":"e69a631af3ef4e6dd2e912ff7e199a73a7a8f16848ce3e23f3651b41d398a0b4","id":"evidence-manifest-run-s_pass_tier1_unsigned","storage_ref":"policy/fixtures/public/gate_s/s_pass_tier1_unsigned/EvidenceManifest.json"},"final_commit_sha":"0000000000000000000000000000000000000000","gate_q_verdict_ref":{"hash":"07c4d68ed14a6930dd008b922687bb04a2120e1000782e9c54b442c1fddc8c19","id":"gate-Q-run-s_pass_tier1_unsigned","storage_ref":"policy/fixtures/public/gate_s/s_pass_tier1_unsigned/GateVerdict.Q.json"},"gate_r_verdict_ref":{"hash":"695dc1ac2c39d0c83bd0ee1d7f500d4db12ae618517f063187575969ff2a5132","id":"gate-R-run-s_pass_tier1_unsigned","storage_ref":"policy/fixtures/public/gate_s/s_pass_tier1_unsigned/GateVerdict.R.json"},"locked_spec_ref":{"hash":"d4f53f946e051a15f08385f617af2356a117c0468909d9817754fcd338c319c4","id":"lockedspec-run-s_pass_tier1_unsigned","storage_ref":"policy/fixtures/public/gate_s/s_pass_tier1_unsigned/LockedSpec.json"},"run_id":"run-s_pass_tier1_unsigned","schema_version":"1.0.0","seal_hash":"9692b736d9e11738d0499834a2066b8075bf039a91bddbc40b02b30d177000b5","sealed_at":"2000-01-01T00:30:00Z","signer":"human:fixture","waivers":[]}
