{"belgi_version":"0.2.0","evidence_manifest_ref":{"hash":"64b3419d5466bb20c82c6619af947c0e36c2753e8fb9a48d8d0702262cc8f1c0","id":"evidence-manifest-run-seal-fixture-001","storage_ref":"policy/fixtures/public/seal/s_pass_tier2_commit_sha_changed/EvidenceManifest.json"},"final_commit_sha":"ffffffffffffffffffffffffffffffffffffffff","gate_q_verdict_ref":{"hash":"e06e844159a63dde305a77826edc62a88ae6d0455b961b03bd964d3a116db382","id":"gate-Q-run-seal-fixture-001","storage_ref":"policy/fixtures/public/seal/s_pass_tier2_commit_sha_changed/GateVerdict.Q.json"},"gate_r_verdict_ref":{"hash":"ff3304e25150a4c1461f7240d12667b8f82d7ddb363eba5f0229ec058f668fc8","id":"gate-R-run-seal-fixture-001","storage_ref":"policy/fixtures/public/seal/s_pass_tier2_commit_sha_changed/GateVerdict.R.json"},"locked_spec_ref":{"hash":"a4af8c7326cc5644d8ec714bcdad19224f3854906e412fcb0cf01fb4c1e10568","id":"lockedspec-run-seal-fixture-001","storage_ref":"policy/fixtures/public/seal/s_pass_tier2_commit_sha_changed/LockedSpec.json"},"run_id":"run-seal-fixture-001","schema_version":"1.0.0","seal_hash":"19b989b1a9953ee126153457a1f372ba92f9f2def61f783602f012c48a61573e","sealed_at":"2000-01-01T00:30:00Z","signature":"9f+56gYIZbJknswoJkp6qEK3eR3qT91INYRt/7rfmZ1cK7vydaqR0MH1hD3V3E2SgzMXp/wyqigykyqcMR2KCg==","signature_alg":"ed25519","signer":"human:fixture","waivers":[]}
