{"belgi_version":"0.2.0","evidence_manifest_ref":{"hash":"64b3419d5466bb20c82c6619af947c0e36c2753e8fb9a48d8d0702262cc8f1c0","id":"evidence-manifest-run-seal-fixture-001","storage_ref":"policy/fixtures/public/seal/s_pass_tier2/EvidenceManifest.json"},"final_commit_sha":"0000000000000000000000000000000000000000","gate_q_verdict_ref":{"hash":"e06e844159a63dde305a77826edc62a88ae6d0455b961b03bd964d3a116db382","id":"gate-Q-run-seal-fixture-001","storage_ref":"policy/fixtures/public/seal/s_pass_tier2/GateVerdict.Q.json"},"gate_r_verdict_ref":{"hash":"ff3304e25150a4c1461f7240d12667b8f82d7ddb363eba5f0229ec058f668fc8","id":"gate-R-run-seal-fixture-001","storage_ref":"policy/fixtures/public/seal/s_pass_tier2/GateVerdict.R.json"},"locked_spec_ref":{"hash":"5a90c7d3b151cb91bf3b1397da14cb61bd7ccc2e27e8458bc0c0a293b9d84c8e","id":"lockedspec-run-seal-fixture-001","storage_ref":"policy/fixtures/public/seal/s_pass_tier2/LockedSpec.json"},"run_id":"run-seal-fixture-001","schema_version":"1.0.0","seal_hash":"2215bb929827e0efd0b766f9bf9b8f14d37c4b5dbcabc09e468a81978ce239be","sealed_at":"2000-01-01T00:30:00Z","signature":"jCSWoWsvHUkWmWxd2s3X8ZY7mZZLTu+C8ItW+WkxQGiFKMoqrCguvyyzNUf7T7+9YqyMu7e6poi4Uld9ePzuAg==","signature_alg":"ed25519","signer":"human:fixture","waivers":[]}
